{
  "company": {
    "name": "Bếp Nhà Mộc",
    "hq_location": "TP.HCM, Việt Nam",
    "mission": "Mang tinh hoa 'Mindful Dining' và nghệ thuật ẩm thực chữa lành (Food Therapy) vào từng bữa ăn gia đình Việt, xoa dịu tâm hồn giữa nhịp sống đô thị hối hả."
  },
  "plan_year": "2026",
  "objective": "Trở thành điểm đến số 1 về không gian ẩm thực chữa lành tại TP.HCM, tập trung vào Gen Z và dân văn phòng đang gặp tình trạng Burnout.",
  "authors": [
    {"name": "Trần Thanh Mộc", "email": "founder@bepnhamoc.vn"},
    {"name": "Lê Văn Strategy", "email": "cmo@bepnhamoc.vn"}
  ],
  "marketing_leaders": [
    {"name": "Trần Thanh Mộc", "title": "Founder & CEO", "bio": "Hơn 15 năm kinh nghiệm trong ngành F&B truyền thống, đam mê ẩm thực nguyên bản và lối sống chánh niệm."},
    {"name": "Lê Văn Strategy", "title": "CMO", "bio": "Chuyên gia về Brand Positioning và Data-driven Marketing, từng định hình chiến lược cho nhiều thương hiệu Lifestyle F&B hàng đầu."}
  ],
  "swot": {
    "strengths": ["Không gian 'Therapeutic Environment' độc bản, không thể sao chép", "Nguồn nguyên liệu 100% Farm-to-Table Organic", "Năng lực nấu ẩm thực truyền thống (mắm nhỉ, cá kho tộ) cực chuẩn vị"],
    "weaknesses": ["Chi phí vận hành (CAC/LTV) ban đầu khá cao do đầu tư cảnh quan", "Quy mô phục vụ (Seating capacity) giới hạn để giữ sự tĩnh lặng"],
    "opportunities": ["Xu hướng 'Chữa Lành' (Healing) đang bùng nổ trong giới trẻ", "Người tiêu dùng sẵn sàng chi trả cao hơn cho thực phẩm sạch và không gian yên tĩnh"],
    "threats": ["Nhiều thương hiệu F&B lớn bắt đầu tích hợp yếu tố không gian xanh", "Rủi ro đứt gãy chuỗi cung ứng nguyên liệu Organic"]
  },
  "initiatives": [
    {"name": "Cinematic Brand Film 'Về Nhà Ăn Cơm'", "description": "Tung ra phim ngắn đậm chất điện ảnh khai thác nỗi đau Toxic Productivity của dân văn phòng.", "goal": "Tạo Viral awareness và định hình rõ khái niệm Food Therapy.", "metrics": "Đạt 2 Triệu Views và 50,000 lượt tương tác trên Social."},
    {"name": "Micro/Macro Influencers Campaign", "description": "Booking 30+ Influencers (Tiktoker, Food Blogger) review về trải nghiệm không gian tĩnh lặng và món ăn gợi nhớ tuổi thơ.", "goal": "Đẩy mạnh lượng khách Gen Z đến quán check-in.", "metrics": "Tăng 300% lượng khách hàng mới từ Social Media."},
    {"name": "Eco-friendly Business Lunch", "description": "Gói ăn trưa cho dân văn phòng đựng trong bao bì bã mía, kèm thẻ thông điệp chữa lành mỗi ngày.", "goal": "Tăng cường tỷ lệ quay lại (Retention) của tệp khách hàng công sở.", "metrics": "Bán 10,000 suất Business Lunch mỗi tháng."}
  ],
  "target_market": {
    "industries": [
      {"name": "Ngành F&B Lifestyle", "description": "Phân khúc nhà hàng không chỉ bán món ăn mà bán cả trải nghiệm tinh thần và lối sống."},
      {"name": "Dịch vụ Sức khỏe Tinh thần", "description": "Xu hướng dùng ẩm thực kết hợp không gian để giải tỏa áp lực tâm lý."}
    ],
    "buyer_personas": [
      {"name": "Mai (25 tuổi) - Gen Z Burnout", "description": "Nhân viên văn phòng, thường xuyên chạy deadline muộn. Cần một nơi yên tĩnh cuối tuần để trốn sếp và mạng xã hội."},
      {"name": "Hoàng (35 tuổi) - Quản lý cấp trung", "description": "Thu nhập cao nhưng thiếu thời gian cho gia đình. Thèm hương vị mâm cơm quê nhà để vơi đi nỗi nhớ quê."}
    ],
    "competitors": [
      {"name": "Cục Gạch Quán", "compete": "Cùng phân khúc quán ăn gia đình truyền thống cao cấp.", "win": "Chúng ta có định vị 'Food Therapy' rõ rệt hơn, nhắm sâu vào insight Gen Z."},
      {"name": "Các quán Cafe Acoustic Xanh", "compete": "Không gian yên tĩnh, có nhạc nhẹ.", "win": "Chúng ta mang lại trải nghiệm ẩm thực no bụng thay vì chỉ đồ uống."}
    ]
  },
  "market_strategy": {
    "product": "Bếp Nhà Mộc cung cấp các mâm cơm chuẩn Việt (Cá lóc kho tộ, canh cua rau đay) trong không gian kiến trúc nhà gỗ chữa lành. Đặc biệt, món ăn 100% nguyên liệu Organic, không bột ngọt. Mỗi khách hàng đều được tặng một tấm thẻ 'Lời khuyên chánh niệm' khi dùng bữa.",
    "price": "Định vị phân khúc Trung - Cao cấp (Premium). Giá trung bình 250,000 - 400,000 VNĐ/người. Mức giá này bù đắp cho Sunk-cost (Chi phí chìm) khổng lồ của việc duy trì không gian xanh và nguyên liệu sạch giữa lòng thành phố.",
    "promotion": "Phủ sóng mạng xã hội với hình ảnh Cinematic và ASMR (âm thanh nấu ăn). Áp dụng Scarcity Marketing (chỉ phục vụ tối đa 50 khách/tối) để tạo độ khan hiếm và đẩy giá trị cảm nhận lên mức cao nhất.",
    "people": "Đội ngũ phục vụ được đào tạo theo triết lý 'Thiền': Đi nhẹ, nói khẽ, giao tiếp bằng ánh mắt và sự tận tâm chân thành.",
    "process": "Từ bước khách bước qua cánh cửa gỗ, ngửi mùi tinh mùi sả chanh, đến khi được dọn mâm cơm nóng hổi... Mọi điểm chạm đều được chuẩn hóa để đảm bảo khách hàng gạt bỏ hoàn toàn áp lực bên ngoài.",
    "services": ["Ăn tại chỗ (Dine-in)", "Giao hàng bã mía Eco-friendly", "Đặt tiệc gia đình riêng tư"]
  },
  "budget": {
    "expenses": [
      {"name": "Cinematic Brand Film (Bếp Nhà Mộc)", "amount": 50000000},
      {"name": "Performance Ads (Facebook/Tiktok)", "amount": 35000000},
      {"name": "KOLs / Influencers Booking", "amount": 55000000}
    ],
    "total": 140000000,
    "currency": "VND"
  },
  "marketing_channels": [
    {"name": "TikTok (ASMR & Review)", "purpose": "Tiếp cận Gen Z, lan truyền video về không gian và âm thanh nấu ăn thư giãn.", "metrics": "Lượt view, lượt chia sẻ, hashtag #BepNhaMoc", "target_value": 3000000},
    {"name": "Facebook Fanpage", "purpose": "Kể chuyện dài (Photo Story), tạo sự kết nối cảm xúc về ký ức gia đình.", "metrics": "Lượng tương tác, tin nhắn đặt bàn.", "target_value": 150000}
  ],
  "marketing_technology": [
    {"name": "BrandFlow AI Engine", "category": "AI Strategy & Automation", "description": "Hệ thống tự động hóa lập kế hoạch và phân bổ chi phí chuẩn xác, giúp Founder kiểm soát dòng tiền."},
    {"name": "Social Listening", "category": "Market Research", "description": "Theo dõi các từ khóa liên quan đến 'chữa lành', 'cơm nhà', 'quán ăn yên tĩnh' để bắt trend và thấu hiểu khách hàng."}
  ]
}
